{
  "source_audio": "/home/jonaswsl/projects/daygame-coach/data/01.download/coach_kyle_how_to_approach_a_girl/How to Fix Rejection in 5 minutes (INFIELD) [JKWRj2hwbT4]/How to Fix Rejection in 5 minutes (INFIELD) [JKWRj2hwbT4].audio.asr.clean16k.wav",
  "audio_sha256": "2f53d26eeb21e92f05db2f44bc8b99c73a6938f24e4093b1afc45af96c2e4839",
  "source_timestamps": "/home/jonaswsl/projects/daygame-coach/data/04.EXT.diarize/coach_kyle_how_to_approach_a_girl/How to Fix Rejection in 5 minutes (INFIELD) [JKWRj2hwbT4]/How to Fix Rejection in 5 minutes (INFIELD) [JKWRj2hwbT4].full.json",
  "processing": {
    "sample_rate": 22050,
    "feature_extractor": "librosa",
    "pitch_range_hz": [
      65.0,
      500.0
    ],
    "pitch_method": "pyin",
    "pitch_trim_percentile": 2.0,
    "embedder": "resemblyzer",
    "embedder_sample_rate": 16000,
    "min_embed_raw_sec": 0.8,
    "min_embed_window_sec": 1.2,
    "embed_pad_sec": 0.25,
    "store_embedding_vectors": false
  },
  "total_duration_sec": 244.814,
  "segments": [
    {
      "start": 0.0,
      "end": 0.821,
      "duration_sec": 0.821,
      "text": "thought you looked really cute",
      "pyannote_speaker": "SPEAKER_00",
      "features": {
        "pitch": {
          "mean_hz": 0.0,
          "std_hz": 0.0,
          "range_hz": 0.0,
          "direction": 0.0
        },
        "energy": {
          "dynamics_db": 9.755603790283203
        },
        "tempo": {
          "syllable_rate": 3.654080389768575
        },
        "spectral": {
          "brightness_hz": 1111.2001942958825
        },
        "quality": {
          "low_energy": false,
          "speech_activity_ratio": 0.8888888888888888
        },
        "speaker_embedding": null
      },
      "audio_clip": {
        "file": "/home/jonaswsl/projects/daygame-coach/data/01.download/coach_kyle_how_to_approach_a_girl/How to Fix Rejection in 5 minutes (INFIELD) [JKWRj2hwbT4]/How to Fix Rejection in 5 minutes (INFIELD) [JKWRj2hwbT4].audio.asr.clean16k.wav",
        "start": 0.0,
        "end": 0.821
      }
    },
    {
      "start": 3.08,
      "end": 10.62,
      "duration_sec": 7.54,
      "text": "nice outfit guys the lack of certainty and no smile communicates this dude's creepy this dude's",
      "pyannote_speaker": "SPEAKER_00",
      "features": {
        "pitch": {
          "mean_hz": 95.035888671875,
          "std_hz": 55.916038513183594,
          "range_hz": 172.0478515625,
          "direction": 0.03362579776636304
        },
        "energy": {
          "dynamics_db": 8.47816276550293
        },
        "tempo": {
          "syllable_rate": 4.774535809018568
        },
        "spectral": {
          "brightness_hz": 1306.6253981617115
        },
        "quality": {
          "low_energy": false,
          "speech_activity_ratio": 0.9323076923076923
        },
        "speaker_embedding": {
          "dim": 256,
          "vector": null
        }
      },
      "audio_clip": {
        "file": "/home/jonaswsl/projects/daygame-coach/data/01.download/coach_kyle_how_to_approach_a_girl/How to Fix Rejection in 5 minutes (INFIELD) [JKWRj2hwbT4]/How to Fix Rejection in 5 minutes (INFIELD) [JKWRj2hwbT4].audio.asr.clean16k.wav",
        "start": 3.08,
        "end": 10.62
      }
    },
    {
      "start": 10.6,
      "end": 16.0,
      "duration_sec": 5.4,
      "text": "not confident this dude's potentially a threat i got rejected i suck i don't even think she",
      "pyannote_speaker": "SPEAKER_00",
      "features": {
        "pitch": {
          "mean_hz": 109.93427276611328,
          "std_hz": 67.32589721679688,
          "range_hz": 173.42105102539062,
          "direction": 0.5231643689310604
        },
        "energy": {
          "dynamics_db": 7.796564102172852
        },
        "tempo": {
          "syllable_rate": 6.296296296296296
        },
        "spectral": {
          "brightness_hz": 1238.4231073670983
        },
        "quality": {
          "low_energy": false,
          "speech_activity_ratio": 0.9914163090128756
        },
        "speaker_embedding": {
          "dim": 256,
          "vector": null
        }
      },
      "audio_clip": {
        "file": "/home/jonaswsl/projects/daygame-coach/data/01.download/coach_kyle_how_to_approach_a_girl/How to Fix Rejection in 5 minutes (INFIELD) [JKWRj2hwbT4]/How to Fix Rejection in 5 minutes (INFIELD) [JKWRj2hwbT4].audio.asr.clean16k.wav",
        "start": 10.6,
        "end": 16.0
      }
    },
    {
      "start": 15.98,
      "end": 20.38,
      "duration_sec": 4.4,
      "text": "actually heard me i could probably still go up and give her a genuine compliment now",
      "pyannote_speaker": "SPEAKER_00",
      "features": {
        "pitch": {
          "mean_hz": 186.5061492919922,
          "std_hz": 24.958709716796875,
          "range_hz": 87.09063720703125,
          "direction": -0.5136413450812108
        },
        "energy": {
          "dynamics_db": 8.396446704864502
        },
        "tempo": {
          "syllable_rate": 6.1363636363636385
        },
        "spectral": {
          "brightness_hz": 1322.7305810603793
        },
        "quality": {
          "low_energy": false,
          "speech_activity_ratio": 0.9736842105263158
        },
        "speaker_embedding": {
          "dim": 256,
          "vector": null
        }
      },
      "audio_clip": {
        "file": "/home/jonaswsl/projects/daygame-coach/data/01.download/coach_kyle_how_to_approach_a_girl/How to Fix Rejection in 5 minutes (INFIELD) [JKWRj2hwbT4]/How to Fix Rejection in 5 minutes (INFIELD) [JKWRj2hwbT4].audio.asr.clean16k.wav",
        "start": 15.98,
        "end": 20.38
      }
    },
    {
      "start": 20.36,
      "end": 26.02,
      "duration_sec": 5.66,
      "text": "hey excuse me hi the biggest mistakes i see is that dudes just don't talk loud enough they don't",
      "pyannote_speaker": "SPEAKER_00",
      "features": {
        "pitch": {
          "mean_hz": 154.15040588378906,
          "std_hz": 26.04678726196289,
          "range_hz": 126.99330139160156,
          "direction": -0.31397166935474147
        },
        "energy": {
          "dynamics_db": 11.017489433288574
        },
        "tempo": {
          "syllable_rate": 5.123674911660777
        },
        "spectral": {
          "brightness_hz": 1067.1981134616371
        },
        "quality": {
          "low_energy": false,
          "speech_activity_ratio": 0.9426229508196722
        },
        "speaker_embedding": {
          "dim": 256,
          "vector": null
        }
      },
      "audio_clip": {
        "file": "/home/jonaswsl/projects/daygame-coach/data/01.download/coach_kyle_how_to_approach_a_girl/How to Fix Rejection in 5 minutes (INFIELD) [JKWRj2hwbT4]/How to Fix Rejection in 5 minutes (INFIELD) [JKWRj2hwbT4].audio.asr.clean16k.wav",
        "start": 20.36,
        "end": 26.02
      }
    },
    {
      "start": 26.0,
      "end": 31.78,
      "duration_sec": 5.78,
      "text": "smile or the rhythm and pace that they're talking at is very awkward and creepy so i'm going to give",
      "pyannote_speaker": "SPEAKER_00",
      "features": {
        "pitch": {
          "mean_hz": 143.2979278564453,
          "std_hz": 27.116453170776367,
          "range_hz": 127.54267883300781,
          "direction": -0.16901664571404754
        },
        "energy": {
          "dynamics_db": 10.003087997436523
        },
        "tempo": {
          "syllable_rate": 5.363321799307958
        },
        "spectral": {
          "brightness_hz": 971.6890651895102
        },
        "quality": {
          "low_energy": false,
          "speech_activity_ratio": 0.8795180722891566
        },
        "speaker_embedding": {
          "dim": 256,
          "vector": null
        }
      },
      "audio_clip": {
        "file": "/home/jonaswsl/projects/daygame-coach/data/01.download/coach_kyle_how_to_approach_a_girl/How to Fix Rejection in 5 minutes (INFIELD) [JKWRj2hwbT4]/How to Fix Rejection in 5 minutes (INFIELD) [JKWRj2hwbT4].audio.asr.clean16k.wav",
        "start": 26.0,
        "end": 31.78
      }
    },
    {
      "start": 31.76,
      "end": 38.54,
      "duration_sec": 6.78,
      "text": "a really creepy awkward compliment right now and watch how it doesn't really hit uh i thought you",
      "pyannote_speaker": "SPEAKER_00",
      "features": {
        "pitch": {
          "mean_hz": 125.95915985107422,
          "std_hz": 31.442153930664062,
          "range_hz": 116.736083984375,
          "direction": -0.11915354136438695
        },
        "energy": {
          "dynamics_db": 9.245071411132812
        },
        "tempo": {
          "syllable_rate": 5.45722713864307
        },
        "spectral": {
          "brightness_hz": 798.0578737133608
        },
        "quality": {
          "low_energy": false,
          "speech_activity_ratio": 0.8938356164383562
        },
        "speaker_embedding": {
          "dim": 256,
          "vector": null
        }
      },
      "audio_clip": {
        "file": "/home/jonaswsl/projects/daygame-coach/data/01.download/coach_kyle_how_to_approach_a_girl/How to Fix Rejection in 5 minutes (INFIELD) [JKWRj2hwbT4]/How to Fix Rejection in 5 minutes (INFIELD) [JKWRj2hwbT4].audio.asr.clean16k.wav",
        "start": 31.76,
        "end": 38.54
      }
    },
    {
      "start": 38.52,
      "end": 44.64,
      "duration_sec": 6.12,
      "text": "looked nice i thought you looked nice take care so you notice that like i don't know if the camera",
      "pyannote_speaker": "SPEAKER_00",
      "features": {
        "pitch": {
          "mean_hz": 156.6315155029297,
          "std_hz": 19.113330841064453,
          "range_hz": 66.9720458984375,
          "direction": -0.12612708836866826
        },
        "energy": {
          "dynamics_db": 14.557082176208496
        },
        "tempo": {
          "syllable_rate": 3.921568627450982
        },
        "spectral": {
          "brightness_hz": 1409.7522028808385
        },